{
  "$comment": "Generated by Studio export from job 2e2671c3-933a-417d-8427-97b7c627e0c9. Provenance below is what was actually charged, and does not cover the `slash` clip, which was authored rather than bought (spec 139). The `swing` state is `oneshot` where scaffold.ts and the mannequin both say `locking`: a locking state refuses every transition until it finishes -- the refusal is stated once at the top of evaluateTransitions and has no exception -- so a body killed mid-swing would finish the swing and fall half a second later. That is the right trade for a monster and the wrong one for the player, which this unit is. Nothing is given away by it, because the wind-up a locking state protects belongs to the server and this machine cannot reach it; during the swing the only transition that matches is `* -> down`.",
  "formatVersion": 1,
  "id": "pig_a_pose_full",
  "meshRef": "pig_a_pose_full.glb",
  "skeletonRef": "../pig.skeleton.json",
  "clipLibRef": "pig.core.cliplib.json",
  "provenance": {
    "tripoTaskIds": {
      "imageToModel": "bebdb9ca-976d-45b2-97e3-469e21fc9fe4",
      "rigCheck": "e3106ae3-b75a-4543-a296-c009570bcc01",
      "rig": "2dcd49d2-ad69-4314-9204-0f291e7c8cdb",
      "retarget": [
        "93c8c7c9-d56f-45d6-8eca-dbd050396b85"
      ]
    },
    "modelVersion": "P1-20260311",
    "faceLimit": 2500,
    "referenceImageSha256": "497b2753a17d859d011b88eb1a168cec97ade64aa8bf97256842eb03ae7e6bde",
    "creditsSpent": 125,
    "generatedAt": "2026-08-10T08:51:47.325Z"
  },
  "import": {
    "normals": "flat",
    "targetTris": 2500,
    "scale": 55.75888947864023,
    "upAxis": "+Y"
  },
  "maxTimeScale": 2,
  "stateMachine": {
    "parameters": [
      {
        "name": "speed",
        "type": "float"
      },
      {
        "name": "dead",
        "type": "bool"
      },
      {
        "name": "attack",
        "type": "trigger"
      }
    ],
    "states": [
      {
        "id": "idle",
        "clipRef": "idle",
        "loop": true,
        "timeScale": 1,
        "blendInMs": 150,
        "category": "loop"
      },
      {
        "id": "locomotion",
        "clipRef": "move",
        "loop": true,
        "timeScale": 1,
        "blendInMs": 150,
        "category": "loop"
      },
      {
        "id": "swing",
        "clipRef": "slash",
        "loop": false,
        "timeScale": 1,
        "blendInMs": 60,
        "category": "oneshot"
      },
      {
        "id": "down",
        "clipRef": "hurt",
        "loop": false,
        "timeScale": 1,
        "blendInMs": 200,
        "category": "terminal"
      }
    ],
    "blendTrees": [
      {
        "id": "move",
        "parameter": "speed",
        "thresholds": [
          {
            "value": 0,
            "clipRef": "idle"
          },
          {
            "value": 34,
            "clipRef": "walk"
          },
          {
            "value": 150,
            "clipRef": "run"
          }
        ]
      }
    ],
    "transitions": [
      {
        "from": "idle",
        "to": "locomotion",
        "condition": "speed > 5",
        "durationMs": 150,
        "interruptible": true
      },
      {
        "from": "locomotion",
        "to": "idle",
        "condition": "speed < 5",
        "durationMs": 150,
        "interruptible": true
      },
      {
        "from": "*",
        "to": "swing",
        "condition": "attack",
        "durationMs": 60,
        "interruptible": false
      },
      {
        "from": "*",
        "to": "down",
        "condition": "dead",
        "durationMs": 200,
        "interruptible": true
      }
    ],
    "actionTimings": [
      {
        "actionId": "basic.attack",
        "windupMs": 500,
        "activeMs": 100,
        "recoveryMs": 200,
        "clipRef": "slash",
        "eventMap": {
          "windup": "swing.start",
          "active": "swing.impact"
        }
      }
    ]
  }
}
