{
  "$comment": "The radish raccoon (spec 277). The mesh arrived from Studio job dc3a200a with an auto-rig onto the `biped` family that could not be used -- measured off the file, its right knee sat 0.33 outside a body 0.5 wide, which is the ordinary failure of a humanoid auto-rig on an animal with no visible legs. So the skeleton is authored (`src/units/radish-raccoon-rig.ts`), the skin is built rather than solved (`src/units/radish-raccoon-skin.ts`), and the two clips are authored too (`src/units/radish-raccoon-clips.ts`). The mesh here is the unrigged generation stood up and re-centred, with the texture carried across verbatim; `npx tsx scripts/make-radish-raccoon.ts` writes it and the family's skeleton, and `npx tsx scripts/make-radish-raccoon-clips.ts` writes the clips and the library. Provenance below is what was actually charged for the generation. The state machine is two clips, so two states and a blend tree between them: there is deliberately no `dead` parameter and no terminal state, because `driveUnit` writes a parameter only if the document declares it and declaring one with no death clip behind it is a socket with nothing plugged into it. The blend tree reaches `run` at 40 rather than at the biped's 150 because there is no walk to sit between them -- 40 is the pace of the slowest thing on the map, so anything actually travelling is drawn running rather than at a fraction of a run.",
  "formatVersion": 1,
  "id": "radish_raccoon_2",
  "meshRef": "radish_raccoon_2.glb",
  "skeletonRef": "../radish_raccoon.skeleton.json",
  "clipLibRef": "../radish_raccoon.core.cliplib.json",
  "provenance": {
    "tripoTaskIds": {
      "imageToModel": "d9b0b917-91fc-487e-ad24-d3eb7a7aa1c7",
      "rigCheck": "a175a8a6-8b09-4217-a7b6-fec9c427a6e6",
      "rig": "b6a968c0-060c-4684-957e-31685dd6fe75",
      "retarget": []
    },
    "modelVersion": "P1-20260311",
    "faceLimit": 12000,
    "referenceImageSha256": "ad45fc21dfb48abbb2f7bed3b3d613f46064d1fc337a5687b21837030a9dcd77",
    "creditsSpent": 75,
    "generatedAt": "2026-09-04T16:29:02.159Z"
  },
  "import": {
    "normals": "flat",
    "targetTris": 11658,
    "scale": 55.75890410958904,
    "upAxis": "+Y"
  },
  "maxTimeScale": 2,
  "stateMachine": {
    "parameters": [
      {
        "name": "speed",
        "type": "float"
      }
    ],
    "states": [
      {
        "id": "idle",
        "clipRef": "idle",
        "loop": true,
        "timeScale": 1,
        "blendInMs": 200,
        "category": "loop"
      },
      {
        "id": "locomotion",
        "clipRef": "move",
        "loop": true,
        "timeScale": 1,
        "blendInMs": 140,
        "category": "loop"
      }
    ],
    "blendTrees": [
      {
        "id": "move",
        "parameter": "speed",
        "thresholds": [
          {
            "value": 0,
            "clipRef": "idle"
          },
          {
            "value": 40,
            "clipRef": "run"
          }
        ]
      }
    ],
    "transitions": [
      {
        "from": "idle",
        "to": "locomotion",
        "condition": "speed > 5",
        "durationMs": 160,
        "interruptible": true
      },
      {
        "from": "locomotion",
        "to": "idle",
        "condition": "speed < 5",
        "durationMs": 200,
        "interruptible": true
      }
    ],
    "actionTimings": []
  }
}
