{
  "$comment": "The development reference unit (spec 110). Not generated by Tripo -- the provenance below is deliberately zeroed rather than faked, because a plausible task id in a committed file is worse than an obvious placeholder.",
  "formatVersion": 1,
  "id": "mannequin",
  "meshRef": "mannequin.glb",
  "skeletonRef": "biped-dev.skeleton.json",
  "clipLibRef": "biped-dev.core.cliplib.json",
  "provenance": {
    "tripoTaskIds": {
      "imageToModel": "local-reference",
      "rigCheck": "local-reference",
      "rig": null,
      "retarget": []
    },
    "modelVersion": "local-reference",
    "faceLimit": 2000,
    "referenceImageSha256": "e3b0c44298fc1c149afbf4c8996fb92427ae41e4649b934ca495991b7852b855",
    "creditsSpent": 0,
    "generatedAt": "2026-01-01T00:00:00Z"
  },
  "import": {
    "normals": "flat",
    "targetTris": 156,
    "scale": 32.35465116279069,
    "upAxis": "+Y"
  },
  "maxTimeScale": 2,
  "stateMachine": {
    "parameters": [
      {
        "name": "speed",
        "type": "float"
      },
      {
        "name": "attack",
        "type": "trigger"
      },
      {
        "name": "dead",
        "type": "bool"
      }
    ],
    "states": [
      {
        "id": "idle",
        "clipRef": "idle",
        "loop": true,
        "timeScale": 1,
        "blendInMs": 150,
        "category": "loop"
      },
      {
        "id": "locomotion",
        "clipRef": "move",
        "loop": true,
        "timeScale": 1,
        "blendInMs": 150,
        "category": "loop"
      },
      {
        "id": "swing",
        "clipRef": "slash",
        "loop": false,
        "timeScale": 1,
        "blendInMs": 60,
        "category": "locking"
      },
      {
        "id": "down",
        "clipRef": "slash",
        "loop": false,
        "timeScale": 0.6,
        "blendInMs": 200,
        "category": "terminal"
      }
    ],
    "blendTrees": [
      {
        "id": "move",
        "parameter": "speed",
        "thresholds": [
          {
            "value": 0,
            "clipRef": "idle"
          },
          {
            "value": 34,
            "clipRef": "walk"
          },
          {
            "value": 150,
            "clipRef": "run"
          }
        ]
      }
    ],
    "transitions": [
      {
        "from": "idle",
        "to": "locomotion",
        "condition": "speed > 5",
        "durationMs": 150,
        "interruptible": true
      },
      {
        "from": "locomotion",
        "to": "idle",
        "condition": "speed < 5",
        "durationMs": 150,
        "interruptible": true
      },
      {
        "from": "*",
        "to": "swing",
        "condition": "attack",
        "durationMs": 60,
        "interruptible": false
      },
      {
        "from": "swing",
        "to": "idle",
        "condition": "exit",
        "durationMs": 120,
        "interruptible": false
      },
      {
        "from": "*",
        "to": "down",
        "condition": "dead",
        "durationMs": 200,
        "interruptible": true
      }
    ],
    "actionTimings": [
      {
        "actionId": "basic.attack",
        "windupMs": 380,
        "activeMs": 120,
        "recoveryMs": 280,
        "clipRef": "slash",
        "eventMap": {
          "windup": "swing.start",
          "active": "swing.impact"
        }
      }
    ]
  }
}
