{
  "$comment": "Generated by Studio export from job cda62fdb-fa04-4596-8cf9-9b369ccf3d60. Provenance below is what was actually charged. Hand-edited afterwards: the export derived a fresh family and wrote it over biped.skeleton.json, but this rig is bone-for-bone the pig's -- same 41 tripo names, same order, same parents -- so it joins that family and borrows its clip library rather than establishing a second one. The retarget list is empty because no clips were bought for this unit; the ones it plays are the family's.",
  "formatVersion": 1,
  "id": "fox_a_pose",
  "meshRef": "fox_a_pose.glb",
  "skeletonRef": "../pig.skeleton.json",
  "clipLibRef": "../pig_a_pose_full/pig.core.cliplib.json",
  "provenance": {
    "tripoTaskIds": {
      "imageToModel": "9602c523-379d-4e2b-bdbc-b8e3c61fdd12",
      "rigCheck": "30b54a7f-02c7-4aa0-8d79-d3f4385909bb",
      "rig": "dc3d0a71-2695-435a-8e43-77b5ff331145",
      "retarget": []
    },
    "modelVersion": "P1-20260311",
    "faceLimit": 2500,
    "referenceImageSha256": "10daa2e3590c11b2a8e5b4dbc357fe01be62ff2c15f2144a6ebb59b8fc230830",
    "creditsSpent": 75,
    "generatedAt": "2026-08-11T23:08:36.917Z"
  },
  "import": {
    "normals": "flat",
    "targetTris": 2500,
    "scale": 55.75891100981619,
    "upAxis": "+Y"
  },
  "maxTimeScale": 2,
  "stateMachine": {
    "parameters": [
      {
        "name": "speed",
        "type": "float"
      },
      {
        "name": "dead",
        "type": "bool"
      },
      {
        "name": "attack",
        "type": "trigger"
      }
    ],
    "states": [
      {
        "id": "idle",
        "clipRef": "idle",
        "loop": true,
        "timeScale": 1,
        "blendInMs": 150,
        "category": "loop"
      },
      {
        "id": "locomotion",
        "clipRef": "move",
        "loop": true,
        "timeScale": 1,
        "blendInMs": 150,
        "category": "loop"
      },
      {
        "id": "down",
        "clipRef": "hurt",
        "loop": false,
        "timeScale": 1,
        "blendInMs": 200,
        "category": "terminal"
      }
    ],
    "blendTrees": [
      {
        "id": "move",
        "parameter": "speed",
        "thresholds": [
          {
            "value": 0,
            "clipRef": "idle"
          },
          {
            "value": 34,
            "clipRef": "walk"
          },
          {
            "value": 150,
            "clipRef": "run"
          }
        ]
      }
    ],
    "transitions": [
      {
        "from": "idle",
        "to": "locomotion",
        "condition": "speed > 5",
        "durationMs": 150,
        "interruptible": true
      },
      {
        "from": "locomotion",
        "to": "idle",
        "condition": "speed < 5",
        "durationMs": 150,
        "interruptible": true
      },
      {
        "from": "*",
        "to": "down",
        "condition": "dead",
        "durationMs": 200,
        "interruptible": true
      }
    ],
    "actionTimings": []
  }
}
